{
  "$schema": "https://json-schema.org/draft/2020-12/schema",
  "title": "ELTS progress-state v1",
  "type": "object",
  "properties": {
    "$schema": {
      "type": "string",
      "minLength": 1
    },
    "schemaVersion": {
      "const": 1
    },
    "project": {
      "type": "string",
      "minLength": 1
    },
    "planVersion": {
      "type": "string",
      "minLength": 1
    },
    "generatedAtUtc": {
      "type": "string",
      "format": "date-time"
    },
    "generatedFrom": {
      "type": "object",
      "properties": {
        "workbookSha256": {
          "type": "string",
          "pattern": "^[0-9a-f]{64}$"
        },
        "specificationSha256": {
          "type": "string",
          "pattern": "^[0-9a-f]{64}$"
        },
        "amendmentRulesSha256": {
          "type": "string",
          "pattern": "^[0-9a-f]{64}$"
        },
        "approvedPlanSha256": {
          "type": "string",
          "pattern": "^[0-9a-f]{64}$"
        },
        "taskCatalogSha256": {
          "type": "string",
          "pattern": "^[0-9a-f]{64}$"
        },
        "authoritiesSha256": {
          "type": "string",
          "pattern": "^[0-9a-f]{64}$"
        },
        "eventCount": {
          "type": "integer",
          "minimum": 0
        },
        "eventSetSha256": {
          "type": "string",
          "pattern": "^[0-9a-f]{64}$"
        }
      },
      "required": [
        "workbookSha256",
        "specificationSha256",
        "amendmentRulesSha256",
        "approvedPlanSha256",
        "taskCatalogSha256",
        "authoritiesSha256",
        "eventCount",
        "eventSetSha256"
      ],
      "additionalProperties": false
    },
    "current": {
      "type": "object",
      "properties": {
        "mode": {
          "enum": [
            "working",
            "blocked",
            "verification",
            "complete"
          ]
        },
        "primaryStepId": {
          "anyOf": [
            {
              "type": "string",
              "pattern": "^(?:P\\d+\\.\\d+(?:\\.[SV]\\d{3})?|BOOT\\.S\\d{3}|DEV-\\d{2}(?:\\.[SV]\\d{3})?|G\\d(?:\\.\\d{2})?|D-\\d{2}|PC-\\d{3})$"
            },
            {
              "type": "null"
            }
          ]
        },
        "activeStepIds": {
          "type": "array",
          "items": {
            "type": "string",
            "pattern": "^(?:P\\d+\\.\\d+(?:\\.[SV]\\d{3})?|BOOT\\.S\\d{3}|DEV-\\d{2}(?:\\.[SV]\\d{3})?|G\\d(?:\\.\\d{2})?|D-\\d{2}|PC-\\d{3})$"
          },
          "minItems": 0,
          "uniqueItems": true
        },
        "nextEligibleStepIds": {
          "type": "array",
          "items": {
            "type": "string",
            "pattern": "^(?:P\\d+\\.\\d+(?:\\.[SV]\\d{3})?|BOOT\\.S\\d{3}|DEV-\\d{2}(?:\\.[SV]\\d{3})?|G\\d(?:\\.\\d{2})?|D-\\d{2}|PC-\\d{3})$"
          },
          "minItems": 0,
          "uniqueItems": true
        },
        "blockingIds": {
          "type": "array",
          "items": {
            "type": "string",
            "minLength": 1
          },
          "minItems": 0,
          "uniqueItems": true
        },
        "phaseId": {
          "type": "string",
          "minLength": 1
        },
        "gateId": {
          "type": "string",
          "minLength": 1
        }
      },
      "required": [
        "mode",
        "primaryStepId",
        "activeStepIds",
        "nextEligibleStepIds",
        "blockingIds",
        "phaseId",
        "gateId"
      ],
      "additionalProperties": false
    },
    "execution": {
      "type": "object",
      "properties": {
        "mode": {
          "enum": [
            "working",
            "blocked",
            "verification",
            "complete"
          ]
        },
        "primaryStepId": {
          "anyOf": [
            {
              "type": "string",
              "pattern": "^(?:P\\d+\\.\\d+(?:\\.[SV]\\d{3})?|BOOT\\.S\\d{3}|DEV-\\d{2}(?:\\.[SV]\\d{3})?|G\\d(?:\\.\\d{2})?|D-\\d{2}|PC-\\d{3})$"
            },
            {
              "type": "null"
            }
          ]
        },
        "activeStepIds": {
          "type": "array",
          "items": {
            "type": "string",
            "pattern": "^(?:P\\d+\\.\\d+(?:\\.[SV]\\d{3})?|BOOT\\.S\\d{3}|DEV-\\d{2}(?:\\.[SV]\\d{3})?|G\\d(?:\\.\\d{2})?|D-\\d{2}|PC-\\d{3})$"
          },
          "minItems": 0,
          "uniqueItems": true
        },
        "nextEligibleStepIds": {
          "type": "array",
          "items": {
            "type": "string",
            "pattern": "^(?:P\\d+\\.\\d+(?:\\.[SV]\\d{3})?|BOOT\\.S\\d{3}|DEV-\\d{2}(?:\\.[SV]\\d{3})?|G\\d(?:\\.\\d{2})?|D-\\d{2}|PC-\\d{3})$"
          },
          "minItems": 0,
          "uniqueItems": true
        },
        "blockingIds": {
          "type": "array",
          "items": {
            "type": "string",
            "minLength": 1
          },
          "minItems": 0,
          "uniqueItems": true
        },
        "selectedPhaseId": {
          "type": [
            "string",
            "null"
          ]
        },
        "selectedLane": {
          "type": [
            "string",
            "null"
          ]
        }
      },
      "required": [
        "mode",
        "primaryStepId",
        "activeStepIds",
        "nextEligibleStepIds",
        "blockingIds",
        "selectedPhaseId",
        "selectedLane"
      ],
      "additionalProperties": false
    },
    "activeWork": {
      "type": "array",
      "items": {
        "type": "object",
        "properties": {
          "owner": {
            "type": "string",
            "minLength": 1
          },
          "taskId": {
            "type": "string",
            "pattern": "^(?:P\\d+\\.\\d+(?:\\.[SV]\\d{3})?|BOOT\\.S\\d{3}|DEV-\\d{2}(?:\\.[SV]\\d{3})?|G\\d(?:\\.\\d{2})?|D-\\d{2}|PC-\\d{3})$"
          },
          "atomicStepId": {
            "type": "string",
            "pattern": "^(?:P\\d+\\.\\d+(?:\\.[SV]\\d{3})?|BOOT\\.S\\d{3}|DEV-\\d{2}(?:\\.[SV]\\d{3})?|G\\d(?:\\.\\d{2})?|D-\\d{2}|PC-\\d{3})$"
          },
          "branch": {
            "type": "string",
            "minLength": 1
          },
          "claimedPaths": {
            "type": "array",
            "items": {
              "type": "string",
              "minLength": 1,
              "pattern": "^(?!/)(?!.*\\\\)(?!.*:)(?!.*(?:^|/)\\.\\.(?:/|$)).+$"
            },
            "minItems": 0,
            "uniqueItems": true
          }
        },
        "required": [
          "owner",
          "taskId",
          "atomicStepId",
          "branch",
          "claimedPaths"
        ],
        "additionalProperties": false
      },
      "minItems": 0,
      "uniqueItems": true
    },
    "tasks": {
      "type": "object",
      "additionalProperties": {
        "type": "object",
        "properties": {
          "status": {
            "type": "string",
            "minLength": 1
          },
          "revision": {
            "type": "integer",
            "minimum": 0
          },
          "lastEventHash": {
            "anyOf": [
              {
                "type": "string",
                "pattern": "^[0-9a-f]{64}$"
              },
              {
                "type": "null"
              }
            ]
          },
          "owner": {
            "type": [
              "string",
              "null"
            ]
          },
          "branch": {
            "type": [
              "string",
              "null"
            ]
          },
          "claimedPaths": {
            "type": "array",
            "items": {
              "type": "string",
              "minLength": 1,
              "pattern": "^(?!/)(?!.*\\\\)(?!.*:)(?!.*(?:^|/)\\.\\.(?:/|$)).+$"
            },
            "minItems": 0,
            "uniqueItems": true
          },
          "evidence": {
            "type": "array",
            "items": {
              "$ref": "evidence.schema.json"
            },
            "minItems": 0,
            "uniqueItems": true
          },
          "blockers": {
            "type": "array",
            "items": {
              "type": "object",
              "properties": {
                "id": {
                  "type": "string",
                  "minLength": 1
                },
                "reason": {
                  "type": "string",
                  "minLength": 1
                },
                "requiredAction": {
                  "type": "string",
                  "minLength": 1
                },
                "responsibleRole": {
                  "type": "string",
                  "minLength": 1
                }
              },
              "required": [
                "id",
                "reason",
                "requiredAction",
                "responsibleRole"
              ],
              "additionalProperties": false
            },
            "minItems": 0,
            "uniqueItems": true
          }
        },
        "required": [
          "status",
          "revision",
          "lastEventHash",
          "owner",
          "branch",
          "claimedPaths",
          "evidence",
          "blockers"
        ],
        "additionalProperties": false
      }
    },
    "atomicSteps": {
      "type": "object",
      "additionalProperties": {
        "type": "object",
        "properties": {
          "status": {
            "type": "string",
            "minLength": 1
          },
          "revision": {
            "type": "integer",
            "minimum": 0
          },
          "lastEventHash": {
            "anyOf": [
              {
                "type": "string",
                "pattern": "^[0-9a-f]{64}$"
              },
              {
                "type": "null"
              }
            ]
          },
          "owner": {
            "type": [
              "string",
              "null"
            ]
          },
          "branch": {
            "type": [
              "string",
              "null"
            ]
          },
          "claimedPaths": {
            "type": "array",
            "items": {
              "type": "string",
              "minLength": 1,
              "pattern": "^(?!/)(?!.*\\\\)(?!.*:)(?!.*(?:^|/)\\.\\.(?:/|$)).+$"
            },
            "minItems": 0,
            "uniqueItems": true
          },
          "evidence": {
            "type": "array",
            "items": {
              "$ref": "evidence.schema.json"
            },
            "minItems": 0,
            "uniqueItems": true
          },
          "blockers": {
            "type": "array",
            "items": {
              "type": "object",
              "properties": {
                "id": {
                  "type": "string",
                  "minLength": 1
                },
                "reason": {
                  "type": "string",
                  "minLength": 1
                },
                "requiredAction": {
                  "type": "string",
                  "minLength": 1
                },
                "responsibleRole": {
                  "type": "string",
                  "minLength": 1
                }
              },
              "required": [
                "id",
                "reason",
                "requiredAction",
                "responsibleRole"
              ],
              "additionalProperties": false
            },
            "minItems": 0,
            "uniqueItems": true
          }
        },
        "required": [
          "status",
          "revision",
          "lastEventHash",
          "owner",
          "branch",
          "claimedPaths",
          "evidence",
          "blockers"
        ],
        "additionalProperties": false
      }
    },
    "decisions": {
      "type": "object",
      "additionalProperties": {
        "type": "object",
        "properties": {
          "status": {
            "type": "string",
            "minLength": 1
          },
          "revision": {
            "type": "integer",
            "minimum": 0
          },
          "lastEventHash": {
            "anyOf": [
              {
                "type": "string",
                "pattern": "^[0-9a-f]{64}$"
              },
              {
                "type": "null"
              }
            ]
          },
          "owner": {
            "type": [
              "string",
              "null"
            ]
          },
          "branch": {
            "type": [
              "string",
              "null"
            ]
          },
          "claimedPaths": {
            "type": "array",
            "items": {
              "type": "string",
              "minLength": 1,
              "pattern": "^(?!/)(?!.*\\\\)(?!.*:)(?!.*(?:^|/)\\.\\.(?:/|$)).+$"
            },
            "minItems": 0,
            "uniqueItems": true
          },
          "evidence": {
            "type": "array",
            "items": {
              "$ref": "evidence.schema.json"
            },
            "minItems": 0,
            "uniqueItems": true
          },
          "blockers": {
            "type": "array",
            "items": {
              "type": "object",
              "properties": {
                "id": {
                  "type": "string",
                  "minLength": 1
                },
                "reason": {
                  "type": "string",
                  "minLength": 1
                },
                "requiredAction": {
                  "type": "string",
                  "minLength": 1
                },
                "responsibleRole": {
                  "type": "string",
                  "minLength": 1
                }
              },
              "required": [
                "id",
                "reason",
                "requiredAction",
                "responsibleRole"
              ],
              "additionalProperties": false
            },
            "minItems": 0,
            "uniqueItems": true
          }
        },
        "required": [
          "status",
          "revision",
          "lastEventHash",
          "owner",
          "branch",
          "claimedPaths",
          "evidence",
          "blockers"
        ],
        "additionalProperties": false
      }
    },
    "gates": {
      "type": "object",
      "additionalProperties": {
        "type": "object",
        "properties": {
          "status": {
            "type": "string",
            "minLength": 1
          },
          "revision": {
            "type": "integer",
            "minimum": 0
          },
          "lastEventHash": {
            "anyOf": [
              {
                "type": "string",
                "pattern": "^[0-9a-f]{64}$"
              },
              {
                "type": "null"
              }
            ]
          },
          "owner": {
            "type": [
              "string",
              "null"
            ]
          },
          "branch": {
            "type": [
              "string",
              "null"
            ]
          },
          "claimedPaths": {
            "type": "array",
            "items": {
              "type": "string",
              "minLength": 1,
              "pattern": "^(?!/)(?!.*\\\\)(?!.*:)(?!.*(?:^|/)\\.\\.(?:/|$)).+$"
            },
            "minItems": 0,
            "uniqueItems": true
          },
          "evidence": {
            "type": "array",
            "items": {
              "$ref": "evidence.schema.json"
            },
            "minItems": 0,
            "uniqueItems": true
          },
          "blockers": {
            "type": "array",
            "items": {
              "type": "object",
              "properties": {
                "id": {
                  "type": "string",
                  "minLength": 1
                },
                "reason": {
                  "type": "string",
                  "minLength": 1
                },
                "requiredAction": {
                  "type": "string",
                  "minLength": 1
                },
                "responsibleRole": {
                  "type": "string",
                  "minLength": 1
                }
              },
              "required": [
                "id",
                "reason",
                "requiredAction",
                "responsibleRole"
              ],
              "additionalProperties": false
            },
            "minItems": 0,
            "uniqueItems": true
          }
        },
        "required": [
          "status",
          "revision",
          "lastEventHash",
          "owner",
          "branch",
          "claimedPaths",
          "evidence",
          "blockers"
        ],
        "additionalProperties": false
      }
    },
    "chains": {
      "type": "object",
      "additionalProperties": {
        "type": "object",
        "properties": {
          "revision": {
            "type": "integer",
            "minimum": 1
          },
          "hash": {
            "type": "string",
            "pattern": "^[0-9a-f]{64}$"
          }
        },
        "required": [
          "revision",
          "hash"
        ],
        "additionalProperties": false
      }
    },
    "integrity": {
      "type": "object",
      "properties": {
        "reducerVersion": {
          "type": "string",
          "minLength": 1
        },
        "valid": {
          "const": true
        },
        "warnings": {
          "type": "array",
          "items": {
            "type": "string",
            "minLength": 1
          },
          "minItems": 0,
          "uniqueItems": true
        }
      },
      "required": [
        "reducerVersion",
        "valid",
        "warnings"
      ],
      "additionalProperties": false
    }
  },
  "required": [
    "$schema",
    "schemaVersion",
    "project",
    "planVersion",
    "generatedAtUtc",
    "generatedFrom",
    "current",
    "execution",
    "activeWork",
    "tasks",
    "atomicSteps",
    "decisions",
    "gates",
    "chains",
    "integrity"
  ],
  "additionalProperties": false
}
