{
  "$schema": "schemas/progress/progress-state.schema.json",
  "schemaVersion": 1,
  "project": "DESS-ELTS-Research-Software",
  "planVersion": "ELTS-build-plan-1.0+PC-001",
  "generatedAtUtc": "2026-09-07T00:51:16.296320+00:00",
  "generatedFrom": {
    "workbookSha256": "65c66cbab533ccf0cee139dba9800d25acb2ea218abac0fe47808361477846ab",
    "specificationSha256": "5cd1632d685a382876abc9cabb5d2da499c226d7c180d0c24422913c5aef531a",
    "amendmentRulesSha256": "9ec4ef3a7c455cb7766cab2f708e90d936feab7e192a918e8736641a28fa7c7d",
    "approvedPlanSha256": "0135c403a00c8cccee2b840f8367af24af5fb8c69ee9380876f4b19140b2dd80",
    "taskCatalogSha256": "d17ba8b7575ffa0ebe2273fadb8c12b0adb5cdbcdd92828d8b69a1d381fc7bd0",
    "authoritiesSha256": "ddfc087607b307a86e95088ad2dbc55545eacf79ba3ff2fc1cb9ed2c81f2ec94",
    "eventCount": 33,
    "eventSetSha256": "b240aab9a162446ef2e5f2b931304f9b7ceebd6caff5601127940117eb694fd9"
  },
  "current": {
    "mode": "working",
    "primaryStepId": "BOOT.S012",
    "activeStepIds": [],
    "nextEligibleStepIds": [
      "P0.2.S001",
      "P0.4.S001",
      "P0.5.S001"
    ],
    "blockingIds": [
      "BOOT.S012",
      "BOOT.S013",
      "BOOT.S014",
      "BOOT.S015",
      "BOOT.S016",
      "BOOT.S017",
      "BOOT.S018",
      "BOOT.S019",
      "BOOT.S020",
      "BOOT.S021",
      "BOOT.S022",
      "BOOT.S023",
      "BOOT.S024",
      "BOOT.S025",
      "D-01",
      "D-02",
      "D-11",
      "D-13",
      "D-14",
      "P0.1.S001",
      "P0.2.S001",
      "P0.4.S001",
      "P0.5.S001",
      "P0.6.S001",
      "P0.6.S002",
      "P0.6.S003",
      "P0.7.S001"
    ],
    "phaseId": "P0",
    "gateId": "G0"
  },
  "execution": {
    "mode": "working",
    "primaryStepId": "BOOT.S012",
    "activeStepIds": [],
    "nextEligibleStepIds": [
      "DEV-01.S001",
      "P0.2.S001",
      "P0.4.S001",
      "P0.5.S001"
    ],
    "blockingIds": [
      "BOOT.S012",
      "BOOT.S013",
      "BOOT.S014",
      "BOOT.S015",
      "BOOT.S016",
      "BOOT.S017",
      "BOOT.S018",
      "BOOT.S019",
      "BOOT.S020",
      "BOOT.S021",
      "BOOT.S022",
      "BOOT.S023",
      "BOOT.S024",
      "BOOT.S025",
      "D-01",
      "D-02",
      "D-03",
      "D-04",
      "D-05",
      "D-06",
      "D-07",
      "D-08",
      "D-09",
      "D-10",
      "D-11",
      "D-12",
      "D-13",
      "D-14",
      "D-16",
      "D-17",
      "DEV-01",
      "DEV-01.S001",
      "DEV-02",
      "DEV-02.S001",
      "DEV-03",
      "DEV-03.S001",
      "DEV-04",
      "DEV-04.S001",
      "DEV-05",
      "DEV-05.S001",
      "DEV-06",
      "DEV-06.S001",
      "DEV-07",
      "DEV-07.S001",
      "DEV-08",
      "DEV-08.S001",
      "DEV-09",
      "DEV-09.S001",
      "DEV-10",
      "DEV-10.S001",
      "DEV-11",
      "DEV-11.S001",
      "DEV-12.S001",
      "G0",
      "G1",
      "G2",
      "G3",
      "G4",
      "G5",
      "G6",
      "G7",
      "P0.1.S001",
      "P0.2",
      "P0.2.S001",
      "P0.4.S001",
      "P0.5.S001",
      "P0.6.S001",
      "P0.6.S002",
      "P0.6.S003",
      "P0.7.S001",
      "P1.1",
      "P1.1.S001",
      "P1.10",
      "P1.10.S001",
      "P1.10.S002",
      "P1.10.S003",
      "P1.11",
      "P1.11.S001",
      "P1.12",
      "P1.12.S001",
      "P1.13",
      "P1.13.S001",
      "P1.14",
      "P1.14.S001",
      "P1.2",
      "P1.2.S001",
      "P1.3",
      "P1.3.S001",
      "P1.3.S002",
      "P1.4",
      "P1.4.S001",
      "P1.4.S002",
      "P1.5",
      "P1.5.S001",
      "P1.5.S002",
      "P1.6",
      "P1.6.S001",
      "P1.6.S002",
      "P1.7",
      "P1.7.S001",
      "P1.7.S002",
      "P1.8",
      "P1.8.S001",
      "P1.8.S002",
      "P1.9",
      "P1.9.S001",
      "P1.9.S002",
      "P2.1",
      "P2.1.S001",
      "P2.2",
      "P2.2.S001",
      "P2.3",
      "P2.3.S001",
      "P2.3.S002",
      "P2.3.S003",
      "P2.3.S004",
      "P2.3.S005",
      "P2.3.S006",
      "P2.3.S007",
      "P2.3.S008",
      "P2.4",
      "P2.4.S001",
      "P2.5",
      "P2.5.S001",
      "P2.5.S002",
      "P2.5.S003",
      "P2.5.S004",
      "P2.5.S005",
      "P2.5.S006",
      "P2.6",
      "P2.6.S001",
      "P2.7",
      "P2.7.S001",
      "P2.8.S001",
      "P2.9",
      "P2.9.S001",
      "P3.1",
      "P3.1.S001",
      "P3.2",
      "P3.2.S001",
      "P3.2.S002",
      "P3.2.S003",
      "P3.3.S001",
      "P3.4",
      "P3.4.S001",
      "P3.4.S002",
      "P3.5",
      "P3.5.S001",
      "P3.6.S001",
      "P3.7.S001",
      "P3.8.S001",
      "P4.1",
      "P4.1.S001",
      "P4.10",
      "P4.10.S001",
      "P4.11",
      "P4.11.S001",
      "P4.11.S002",
      "P4.11.S003",
      "P4.11.S004",
      "P4.11.S005",
      "P4.11.S006",
      "P4.11.S007",
      "P4.12",
      "P4.12.S001",
      "P4.13.S001",
      "P4.2",
      "P4.2.S001",
      "P4.3",
      "P4.3.S001",
      "P4.4",
      "P4.4.S001",
      "P4.5",
      "P4.5.S001",
      "P4.6",
      "P4.6.S001",
      "P4.7",
      "P4.7.S001",
      "P4.7.S002",
      "P4.8",
      "P4.8.S001",
      "P4.9",
      "P4.9.S001",
      "P5.1",
      "P5.1.S001",
      "P5.10.S001",
      "P5.2",
      "P5.2.S001",
      "P5.3",
      "P5.3.S001",
      "P5.4",
      "P5.4.S001",
      "P5.5",
      "P5.5.S001",
      "P5.6",
      "P5.6.S001",
      "P5.7",
      "P5.7.S001",
      "P5.8",
      "P5.8.S001",
      "P5.9.S001",
      "P6.1",
      "P6.1.S001",
      "P6.10",
      "P6.10.S001",
      "P6.10.S002",
      "P6.11.S001",
      "P6.12.S001",
      "P6.13.S001",
      "P6.2",
      "P6.2.S001",
      "P6.3",
      "P6.3.S001",
      "P6.4",
      "P6.4.S001",
      "P6.5",
      "P6.5.S001",
      "P6.6",
      "P6.6.S001",
      "P6.6.S002",
      "P6.7",
      "P6.7.S001",
      "P6.8",
      "P6.8.S001",
      "P6.8.S002",
      "P6.8.S003",
      "P6.9",
      "P6.9.S001",
      "P7.1",
      "P7.1.S001",
      "P7.2",
      "P7.2.S001",
      "P7.3",
      "P7.3.S001",
      "P7.4",
      "P7.4.S001",
      "P7.5",
      "P7.5.S001",
      "P7.6.S001",
      "P7.7.S001",
      "P7.8.S001",
      "P7.9.S001",
      "P8.1",
      "P8.1.S001",
      "P8.2",
      "P8.2.S001",
      "P8.3",
      "P8.3.S001",
      "P8.4",
      "P8.4.S001",
      "P8.5",
      "P8.5.S001",
      "P8.6",
      "P8.6.S001",
      "P8.7.S001",
      "P8.8.S001"
    ],
    "selectedPhaseId": "P0",
    "selectedLane": "bootstrap"
  },
  "activeWork": [],
  "tasks": {
    "P0.1": {
      "status": "not_started",
      "revision": 0,
      "lastEventHash": null,
      "owner": null,
      "branch": null,
      "claimedPaths": [],
      "evidence": [],
      "blockers": []
    },
    "P0.2": {
      "status": "ready",
      "revision": 0,
      "lastEventHash": null,
      "owner": null,
      "branch": null,
      "claimedPaths": [],
      "evidence": [],
      "blockers": []
    },
    "P0.3": {
      "status": "in_progress",
      "revision": 33,
      "lastEventHash": "1dc2dc85dbe63faf88c50b39377a28508fdd206665ab6943c498a7ab20f9b398",
      "owner": "agent:codex-astra",
      "branch": "bootstrap/repository-governance",
      "claimedPaths": [],
      "evidence": [],
      "blockers": []
    },
    "P0.4": {
      "status": "ready",
      "revision": 0,
      "lastEventHash": null,
      "owner": null,
      "branch": null,
      "claimedPaths": [],
      "evidence": [],
      "blockers": []
    },
    "P0.5": {
      "status": "ready",
      "revision": 0,
      "lastEventHash": null,
      "owner": null,
      "branch": null,
      "claimedPaths": [],
      "evidence": [],
      "blockers": []
    },
    "P0.6": {
      "status": "not_started",
      "revision": 0,
      "lastEventHash": null,
      "owner": null,
      "branch": null,
      "claimedPaths": [],
      "evidence": [],
      "blockers": []
    },
    "P0.7": {
      "status": "not_started",
      "revision": 0,
      "lastEventHash": null,
      "owner": null,
      "branch": null,
      "claimedPaths": [],
      "evidence": [],
      "blockers": []
    },
    "P1.1": {
      "status": "not_started",
      "revision": 0,
      "lastEventHash": null,
      "owner": null,
      "branch": null,
      "claimedPaths": [],
      "evidence": [],
      "blockers": []
    },
    "P1.2": {
      "status": "not_started",
      "revision": 0,
      "lastEventHash": null,
      "owner": null,
      "branch": null,
      "claimedPaths": [],
      "evidence": [],
      "blockers": []
    },
    "P1.3": {
      "status": "not_started",
      "revision": 0,
      "lastEventHash": null,
      "owner": null,
      "branch": null,
      "claimedPaths": [],
      "evidence": [],
      "blockers": []
    },
    "P1.4": {
      "status": "not_started",
      "revision": 0,
      "lastEventHash": null,
      "owner": null,
      "branch": null,
      "claimedPaths": [],
      "evidence": [],
      "blockers": []
    },
    "P1.5": {
      "status": "not_started",
      "revision": 0,
      "lastEventHash": null,
      "owner": null,
      "branch": null,
      "claimedPaths": [],
      "evidence": [],
      "blockers": []
    },
    "P1.6": {
      "status": "not_started",
      "revision": 0,
      "lastEventHash": null,
      "owner": null,
      "branch": null,
      "claimedPaths": [],
      "evidence": [],
      "blockers": []
    },
    "P1.7": {
      "status": "not_started",
      "revision": 0,
      "lastEventHash": null,
      "owner": null,
      "branch": null,
      "claimedPaths": [],
      "evidence": [],
      "blockers": []
    },
    "P1.8": {
      "status": "not_started",
      "revision": 0,
      "lastEventHash": null,
      "owner": null,
      "branch": null,
      "claimedPaths": [],
      "evidence": [],
      "blockers": []
    },
    "P1.9": {
      "status": "not_started",
      "revision": 0,
      "lastEventHash": null,
      "owner": null,
      "branch": null,
      "claimedPaths": [],
      "evidence": [],
      "blockers": []
    },
    "P1.10": {
      "status": "not_started",